company,title,date,year,rating,pros,cons
Microsoft,"Great Company, Good Benefits, So Many Smart People to Learn From",Oct 27,2021,5,"- Benefits (PTO, Sick Leave, Paternity/Maternity leave, Gym, HSA Contribution, etc) - Learning from so many smart and talented people around you - Work Life Balance - Effective feedback mechanisms not only for ICs but also for Managers - Stock Growth Rate - MSR (Microsoft Research)","Microsoft is already a great company (definitely one of the top 5 in the world IMHO), I had a great experience there and I am very thankful for my years at Microsoft. I learned a lot, and I am hoping to come back to Microsoft again at some point in my career. However, I believe these are the things that can be improved: - Speed: older orgs are reluctant to change - Benefits fall behind top competitions (Google, FB) - Office Politics (in some but definitely not all teams and orgs) - Unlike companies like FB and Amazon that are willing to take some risks and trust younger employees based on their performance and capabilities for management and leadership roles, at Microsoft (at least some older orgs) certain jobs are always indefinitely ""reserved"" for employees with +20 years of experience, even when they don't have relevant experiences or expertise. - Too many PMs wrt the number of Eng and DS/AS ICs, which has shifted (too much) the atmosphere of the company from an Eng to PM company - Many free-riders! :)"
Microsoft,"low RSUs, salary, bonuses and career growth",Apr 5,2021,4,"Great work life balance, good health benefits. The D&I is being worked on but it is not yet the greatest. a lot to be done!","Average Engineers, Scientists and PMs with not related degrees in the task or title they are assigned to.. it is pretty political to get promotions and get visibility .. Highly PM oriented (you expect MSFT to be Engineer oriented.. well, you are wrong :) ) ...Low compensation, bonus, RSU and career development.. People leave after 3 to 4 years on an average.. only a limited ones would stay (they are usually the ones who can not get a better offer somewhere else (low competency in their title; but highly politically correct to play the game there right).. Good luck receiving promotion (you get stuck at the senior level 63/4 there)."
Microsoft,yeah,Mar 2,2022,3,good WLB for the pay mostly chill good colleagues,SLT acknowledges problems but rarely addresses them substantively awkward/mixed communication regarding remote work/COVID need to address pay gap with other techco's because people are going to jump if raises are not competitive to outside offers
Microsoft,One of the best companies to work for,Mar 11,2022,5,Growth opportunities. Leadership. Competitive salary.,Not too many downsides I know of.
Microsoft,Mid career employee,Feb 26,2022,5,Work life balance and Good guidance from seniors,Not too many transferable skills Stock refreshes are bad
Microsoft,"underpay, bureaucracy, no hope",Jun 15,2022,1,work life balance.. not criticized if not working hard,"bureaucracy, toxic, discrimination .. no competitive colleagues and no normal pay check"
Microsoft,good,Jun 5,2022,4,"very nice, great working atomosphere",interview process is very long
Microsoft,Culture and strategy in right direction,Apr 8,2022,4,"Company is progressing in right direction with meaningful values, like ""growth mindset"", ""diverse and inclusive"", ""one Microsoft"" Large spectrum of product options to work on","low salary, especially for senior folks"
Microsoft,Pluses and minuses,Jan 18,2022,5,"Projects, people, growth opportunity, work life balance","Bureaucracy, politics, lower pay compared to competitors"
Microsoft,Good,Jan 13,2022,5,High payments and best facilities,Hectic work schedule and pressure
Microsoft,idk,May 1,2022,3,competitive salary with good bonus,work life balance was a little tough
Microsoft,good wlb,Dec 21,2021,5,I like the good wlb at the company,I think the pay is lower than market
Microsoft,good,Dec 25,2021,5,it is the best way of that,Internship at DigikalaNext as python developer
Microsoft,It depends on what’s more important to you,Mar 28,2022,3,Work life balance is definitely better than FAANG companies,Low salary compared to similar companies
Microsoft,Great place to work,Feb 27,2022,4,Microsoft - Xbox is very respectful of work life balance. There are interesting and challenging problems to work on.,"Process and ""socialization ideas"" meetings take up a large chunk of time."
Microsoft,Work life balance,Mar 14,2022,4,A good work life balance,Many Dumb managers a principal levels - just enjoying the benfits
Microsoft,Best work environment,Dec 9,2021,5,Best work environment and location,There are no cons yet
Microsoft,Great company,Nov 1,2021,5,"Great benefits, health coverage, etc.","Can't think of anything. There is some politics, but to be expected at any large company."
Microsoft,Good Company,Mar 4,2022,4,Good Work Life Balance Here,Low Pay Compared To Market Rates
Microsoft,Best place to work,Feb 15,2022,4,"benefits for healthcare , cultures, good management ,","work load, stressful, work like balance."
Microsoft,Good Company,Feb 24,2022,4,Great WLB and kind people,Big Old Bloated Tech Company
Microsoft,Great company,Jan 19,2022,4,"Benefits are great, WLB depends on your team, many smart folks to learn from",Career growth can be slow
Microsoft,great company,Oct 25,2021,5,The salary is very good,Sometimes the pressure is a little high
Microsoft,I’m having a great time,Aug 30,2021,5,This is my first job out of college. The pay is competitive and I have people that are invested in my professional development.,Location is far from home but with remote working is very bearable
Microsoft,Data scientist,Oct 15,2021,5,Very Good work life balance,So far so not have any
Microsoft,microsoft,Oct 12,2021,5,perfect place to work for,no cons at all here
Microsoft,"Great Benefits, decent pay, great work/life",Sep 12,2021,5,So many skills can be learned and various project experiences available.,Big company slowness and red tape.
Microsoft,Good company,Oct 2,2021,5,"good culture, care about people",not have any so far
Microsoft,awesome culture,Sep 21,2021,5,It has the best culture i've ever experienced,Most of the offers are in seattle
Microsoft,good wlb,Sep 9,2021,5,good wlb in most time,low salary for the same amount of work
Microsoft,Good Salary,Sep 1,2021,5,Good stock options and very good benefits,Work can be overlaping with other teams
Microsoft,Great WLB,Sep 1,2021,5,"Great WLB, pay is still pretty good",gets a little boring sometimes
Microsoft,Innovative,Aug 2,2021,5,Great work life balance and customer obsessed,There are lot's and lots of customer workloads to drive which is a good thing
Microsoft,Great place to work,Jul 20,2021,5,"Great team, continuous learning opportunities, culture, work-home flexibility, interesting problems","Process, typical challenges of navigating big company dynamics"
Microsoft,Nice experience,Nov 10,2021,4,"Big team. many chance to learn and grow, and they really care about your growing",Not much at this point
Microsoft,good but could be better,Nov 15,2021,3,"good wlb, good benefits, that's it.","low salary, work politics is heavier"
Microsoft,DS at Microsoft,Nov 9,2021,4,Great work life balance and team environment,Slow growth speed and not the most advanced tools
Microsoft,Great Company,Oct 27,2021,4,"Good business results, sound strategic direction, great benefits",Slow upward mobility in terms of level advancement
Microsoft,Best,Jul 4,2021,5,Best company to work at,No cons really visible right now.
Microsoft,Great place to work,Jun 7,2021,5,"Great people and work culture, lots of flexibility. Interesting ML problems",Large company and internal tools can be lacking
Microsoft,Good place to work,Jun 18,2021,5,"Generally good WLB, meaningful work",Not competitive pay for senior and below
Microsoft,Bad management,Jul 29,2021,3,Work life balance is good. Lots of learning opportunities. Company nonmonetized benefit is good. Diversity and inclusion culture. Leadership transparent,"Org hired unprofessional inexperienced manager without any industry experience, caused a couple of PUA and abuse scenarios.never ever in my career worked with such toxic management. Microsoft doesn’t live its name. Career growth is insanely slow."
Microsoft,good,Oct 19,2021,4,good work life balance all,old tech and slow pace
Microsoft,Not a bad place to work,Jul 22,2021,4,Good work life balance Amazing Cafeteria,"Projects were boring Developers, Developers, Developers, Developers, not much respect for science"
Microsoft,Big Tech and Big bureaucracy,Jun 3,2021,4,Stable and Interesting Tech to work on,"So much bureaucracy and some teams are a lot to work for, but MSFT pays you for WLB. So why work a lot if you aren't paid market value?"
Microsoft,Data Scientist,Jul 15,2021,4,Good pay Good management team,Long hours No work life balance
Microsoft,Dats science at Microsoft,Jun 30,2021,3,1. Great company 2. Great benefits 3.,1. Hierarchical 2. Bad management - highly dependent on team
Microsoft,Best,Jul 4,2021,5,Best company to work at,No cons really visible right now.
Microsoft,Great place to work,Jun 7,2021,5,"Great people and work culture, lots of flexibility. Interesting ML problems",Large company and internal tools can be lacking
Microsoft,Good place to work,Jun 18,2021,5,"Generally good WLB, meaningful work",Not competitive pay for senior and below
Microsoft,Not as good as you might imagine.,May 2,2021,3,Lots of under-utilized data to analyze or explore for the first time.,"Many teams or stakeholders are not analytically mature. Data recommendations may not be acted upon, leading to low impact."
Microsoft,Salary,Jun 19,2021,4,Benefit is good compared to many other companies,Ttl package is not super competitive
Microsoft,Very good company to work for!,Apr 13,2021,5,"Benefits, career growth and opportunity to work with great /super intelligent people.","Lots of process, takes time to get things across. Not the best for work life balance."
Microsoft,Great Company to work for,May 15,2021,5,"Solid perks, considerable time off, reasonable work life balance",Pay is less than top tech peers
Microsoft,Great place to work,May 5,2021,5,Nice team members. Supports work-life balance and family life,Can be very political at times.
Microsoft,Pretty solid okay,Feb 24,2021,4,"Good benefits, low psychopath ratio at individual contributor levels. It is possible to coast.","High psychopath ratio at partner and above, but where isn’t that true? Rewards and promotions not really proportional to contributions. Selling works. Same as any other workplace."
Microsoft,great culture,May 9,2021,4,"culture is very inclusive, and great manager",the salary is not competitive
Microsoft,Microsoft Consulting Services has a long way to go,Mar 28,2021,3,"great benefits, opportunity to work with very talented people, leadership culture is good","no work-life balance, no teamwork, competitive and draining"
Microsoft,Work Life Balance,Apr 26,2021,4,"Work Life Balance, Benefits and Flexible working hours","Not challenging, Not cutting edge"
Microsoft,Great work life balance,Apr 23,2021,4,Work life balance is great,Pay is below avg and varies between teams
Microsoft,default,Apr 27,2021,5,"career opportunities, team and work culture.",a large company with dispersed priorities.
Microsoft,A company that lives its values,Feb 15,2021,5,The company is on the vanguard of the ethical use of data.,"The company aspires to be a meritocracy, but there are thousands of managers with different interpretations of excellence, which affects bonuses and promos."
Microsoft,Great place to work,Mar 29,2021,5,"company culture, work life balance","lower salary compared to competitors, RSU cliff after 4 years"
Microsoft,Decent Job,Apr 7,2021,4,Pay to WLB is unrivaled Brand on resume,Work isn't stimulating Mostly reporting and querying
Microsoft,Good,Apr 2,2021,5,"Good, very good do recommend","None, no complaints, I need the 5 word limit"
Microsoft,nice work culture,Mar 27,2021,5,nice work culture. Everyone should apply here,I don't have anything to crib about
Microsoft,Love it!,Mar 22,2021,5,"Love the culture, the competitive pay, and WLB",Nothing I can think of really
Microsoft,Data scientist,Mar 11,2021,5,Amazing work life balance and independence,Old big company so you get more complacency than a startup
Microsoft,Great culture,Mar 23,2021,5,"great culture, diversity and inclusion",compensation at Microsoft is suboptimal
Microsoft,I love my job at Microsoft,Jan 27,2021,5,Best work life balance. Learning a lot from top scientists/researchers. Working on projects that impacts millions of people,The personal contributions in such a large company is very minor.
Microsoft,"Great culture, awesome benefits",Feb 25,2021,4,Great opportunities to do a wide range of tasks,Internal transfers are hard without making a lot of connections
Microsoft,Good solid job with growth opportunity,Jan 14,2021,5,You get to work with some really talented people and the company invests in your growth as an employee.,"Things move slowly at times, and their are too many reorgs."
Microsoft,Good job,Feb 24,2021,5,"Work life balance, Perks, Remote Work","Pay, Stock, Training, Management, Misc"
Microsoft,Nice,Jan 24,2021,5,Nice Project and work Culture,Not so far at this moment
Microsoft,Great Company,Jan 13,2021,5,Great WLB. Awesome perks. Supportive teammates.,Large hierarchy. Average compensation. No free food.
Microsoft,Very nice,Jan 17,2021,5,I find it very comfortable WFH.,I haven't found out yet.
Microsoft,Great place to work,Dec 29,2020,5,"Work life balance, Competitive Pay, 401k, Dental, Paid time off",No real downsides for the role
Microsoft,Best place for work culture and growth,Nov 25,2020,5,"work life balance, lots of learnings to do","lots of job duplication, very fat middle management company, so too many reorgs and politics."
Microsoft,Pretty solid okay,Feb 24,2021,4,"Good benefits, low psychopath ratio at individual contributor levels. It is possible to coast.","High psychopath ratio at partner and above, but where isn’t that true? Rewards and promotions not really proportional to contributions. Selling works. Same as any other workplace."
Microsoft,great culture,May 9,2021,4,"culture is very inclusive, and great manager",the salary is not competitive
Microsoft,Microsoft Consulting Services has a long way to go,Mar 28,2021,3,"great benefits, opportunity to work with very talented people, leadership culture is good","no work-life balance, no teamwork, competitive and draining"
Microsoft,Work Life Balance,Apr 26,2021,4,"Work Life Balance, Benefits and Flexible working hours","Not challenging, Not cutting edge"
Microsoft,Great work life balance,Apr 23,2021,4,Work life balance is great,Pay is below avg and varies between teams
Microsoft,good place to work,Jan 12,2021,4,"i like it, its a good place",i have too much fun here haha
Microsoft,Depends on the teams...,Dec 7,2020,4,I've been on several teams. The experience all depends on the team and your manager.,Working across teams can be hard. Very few people in upper management understand data science.
Microsoft,Great culture,Oct 29,2020,5,- Great culture that - company values inclusion and diversity - CEO is inspiring,- Tech stack can be a mess
Microsoft,Good growth,Oct 27,2020,5,Good culture. Learned a lot.,Management can take more ownership.
Microsoft,Great company to work for,Oct 6,2020,5,"Great work life balance, smart people",A lot of re org for some teams
Microsoft,epic,Sep 20,2020,4,money is kind of cool i guess,eh it kinda sucks sometimes but that be life on the real tho
Microsoft,Good place,Oct 12,2020,5,good place and good team,"sometimes too busy, food not free."
Microsoft,Fantastic company,Sep 17,2020,5,"Culture, people, technology and growth opportunities","I can't think of any cons working at Microsoft, at least in my experience"
Microsoft,great,Sep 23,2020,4,acceptable work life balance culture,slow and bad designed technology and tooling
Microsoft,Great work atmosphere at Cambridge location,Apr 16,2019,5,"Colleagues are very friendly and sharp, competent people: many are recent graduates of local colleges and graduate programs. There is a great work atmosphere cultivated by leadership that has been with this department since it was acquired from Nokia years ago. There are opportunities to make a name for yourself and expand your skill set with challenging projects, but also tolerance for us older folks who need to prioritize a work-life balance at some point in their career. (And perhaps for that reason, this group has a better gender ratio and more parents than most companies or other divisions of Microsoft.) Open to occasional remote work.","Many colleagues who have been with the department a while are now at a senior level and have a hard time advancing further within the company. (There are only so many opportunities for management or high-level independent contributor positions, and even fewer are at the Boston office specifically.) It's a testament to the atmosphere of the team and the quality of the projects that these folks stick around. Not a problem if you are planning to come in at entry level and OK with potentially switching companies after a few years."
Microsoft,Follow your passion and you can have a great career here,Feb 27,2019,4,"Opportunities abound and you can explore a wide variety: different stages of businesses (research, incubation, startup, mature), different roles (software engineer, data scientist, etc.), different regions (USA, China, etc.), and many other dimensions. Make sure you know what your management chain values and how their performance is evaluated and work on projects that align to their values and performance goals. Great people to work with, challenging problems to solve, and the culture continues to improve. When you start a project, you don't know it yet, but there will be at least a half dozen other teams doing the similar work with whom you will collaborate and learn.",Performance rewards are based on impact but we don't quantify impact.. How and why rewards were given has become a black box. You will always be able to find a company that offers more pay/rewards.
Microsoft,A company that lives its values,Dec 17,2019,4,"Microsoft's mission is to empower others, to help them achieve more, which is something you can feel good about, especially if you're passionate about technology. When you show up to work, you can feel like you're making a positive difference in the world, and you get to work on cutting-edge technology. Moreover, leadership is thoughtful about the culture it fosters. They try to create a collaborative work environment, encourage people to have an open mindset, celebrate diversity and inclusion, support continuous learning, and more. The company truly lives its values.","People are still people, so some situations will be better than others."
Microsoft,Microsoft,Jun 14,2016,4,"Good work life balance. Lots of respect from people you work with. Great managers who cares about you. Lots of very talented people. Family oriented culture, people respect your personal time. Even if you don't like something, it will likely to change organically in a few months.","Slow to get promotion. Even if you are a top performer, you might not get recognized well enough due to managers peanut buttering the review results. Hard to get things done with such a large org. Too many people to criticize your work without doing anything."
Microsoft,Optimization of the business often trumps human factors,Dec 28,2018,3,"1. Good pay to work-life balance ratio: if you're trying to maximize income with decent constraints on your level of effort and time, then MS is probably a good choice. 2. Offices! Single occupancy offices for most of the Redmond-based employees! 3. Hierarchy is surprisingly flat in many parts of the company. This is true at most companies, and it's certainly true here. If you get along with your immediate manager, you will find your time here tolerable.","1. MS keeps dogfooding its products on employees and moving people around: both re-orgs and office moves. The company has an optimizing culture that neglects its effects on humans. Then they try to compensate in the worst way possible: corporate initiatives. Growth mindset, inclusivity, etc. They'll put up posters and send out emails that people just ignore or mock. 2. They are gradually converting offices to open space. 3. Tons of politics. Much of the old guard feel obligated to justify their employment; they attempt to ""own"" as much as possible, usually to the detriment of projects and the mental health of individual contributors. 4. The left hand doesn't know what it's own fingers are doing, let alone the right hand. There is a lot of duplicated work, competing internal technologies (cf. Skype and Teams), and a complete lack of communication across different parts of the company."
Microsoft,Great place for a data scientist,Jan 18,2018,5,With most Microsoft products getting online the amount of data you get to work with is enormous. A lot of low hanging fruit (few people looked at the data before you) means you can generate a lot of impact. Great infrastructure for working with large volumes of data means you spend more time analyzing the data and less worrying about processing it efficiently.,"You need to be skilled in corporate politics. Not everyone is bought into being data driven, and ownership issues may get on the way."
Microsoft,"Great benefits, great people in pockets",Nov 22,2019,4,Great benefit. Great work-life balance. You will find very knowledgable people in pockets across MSFT (not only in MSR).,To make a business impact teams are doing similar things in complete isolation. Little to no co-operation. Least bothered about the product but more important is to make the business impact. There are teams where people are still holding on to the old framework and reinventing the wheel. No intention of adapting the changes with recent developments.
Microsoft,"Secure, frustrating, ultimately uninteresting",Mar 5,2014,2,Compensation was good. Job security. Data at large scale means there's potential to do some interesting work.,"Difficult to impossible to do meaningful interesting work. Physical and process infrastructure is so slow and so much contention for the few interesting projects that it's all about positioning, rarely about doing good work. In my area (software engineering as applied to big data problems) not being able to use open-source technologies means your skill set will quickly become obsolete."
Microsoft,"Good place to work, with drawbacks",Jun 24,2019,4,People generally are very kind and intelligent. Some very interesting projects. Potential growth of the company in an AI space is compelling.,Job may entail a lot more data engineering than data science. Microsoft COSMOS is not so great to use. Too many meetings. Reliance on dying tools/platforms.
Microsoft,Applied Data Science,Oct 9,2015,3,"Not too much stress, You have your own office (if it helps!), good compensation and many other benefits.",Social life is not very great in many groups in Microsoft and the competition between team members is not very cool sometimes.
Microsoft,Data scientsit,Apr 9,2018,4,Great project Friendly and supportive team members Flexible working schedule. You can choose working hard or a better work-life balance Good medical/dental insurance,Low salary comparing with other companies like Netflix. I am trapped here only because of my green card application.
Microsoft,Great Company to work for,Jun 30,2013,4,Awesome benefits. Get your own office. The campus is amazing. It's generally a fun place to work.,"Management is set in their ways and thus although they preach innovation, innovation often gets stifled . The bureaucracy in the firm is crippling. Stack ranking KILLs collaboration"
Microsoft,Great company on the right track,Aug 12,2018,4,You are working with a group of smartest people in the world. The daily work in interesting and challenging. Good work-life balance.,Sometimes the program managers stole credits from you because they pretend to know everything you are doing and they drive the agenda of a project.
Microsoft,Depends on your team,Mar 8,2016,3,"Great pay and benefits. Company culture is improving. If you're on the right team, there's lots of interesting work to be done.","If you're on the wrong team, it can be dreadful. The culture may be improving, but the hierarchy is deep and cumbersome. You need someone to teach you the politics."
Microsoft,Great Experience,Apr 30,2016,4,Great Benefits Good work-life balance Many smart people working with you,"Promotion and growth is not easy, depends on how your manager likes you The teams are not connected. inter-team collaboration is not easy Often you can find many teams doing the same work/tool."
Microsoft,World class vision with a renewed sense of purpose in the technology world. But with its bureaucratic woes!,Jul 14,2019,5,"Smart people with great career mobility, upwards and laterally","Often slow. Marketing org is fairly political, which can be a good place to learn the game but equally demotivating at times."
Microsoft,Generally good place to work,Apr 9,2016,4,"Solid benefits, flexible work schedule, generally decent people to work with, interesting problems to solve.","Career growth can be challenging depending on the team you're on, sometimes politics get in the way of getting things done."
Microsoft,Great place to work,Nov 7,2014,5,Smart and very helpful colleagues Great projects,There aren't many cons. But can certainly do with more agility in processes.
Microsoft,Excited to work at MSFT,Oct 2,2019,5,New opportunities and cutting-edge technologies,It is difficult to have a work and life balance!
