company,title,date,year,rating,pros,cons
Amazon,Be ready to write lot of documents,Jun 24,2019,4,Push your limits with unreal expectations,no guidance in terms and work and career growth
Amazon,"Great place to work, learn and gain experience",Nov 4,2019,4,"Great place to work, learn and gain experience. Opportunities to work at huge scale. Only work matters and nothing else. Work from home option.",Sometimes it is hectic.
Amazon,Great place to work!,Feb 4,2020,4,> Great manager. > Good work-life balance. > Freedom to present ideas,"> Competitive work environment. Not necessarily a con, in the sense that people are a bit too ambitious"
Amazon,Amazing set of guiding principles,Apr 19,2020,5,There is a process for everything so the learning curve is steep,The company is too large so the bar of scientists has diluted a little
Amazon,Worth Everything,May 31,2020,5,The company benefits and the structuring of the employee payment is nice.,There arent any worthwhile to talk about
Amazon,awesome,Jun 16,2020,5,"Benkiii and awesome, helpful,national level","difficult to get in, minimal efforts required"
Amazon,Lead Your Way,Aug 15,2020,5,The best place to push your leadership potential.,"Some procedures are too heavy, but it is fine."
Amazon,Best company in the world,Aug 29,2020,4,"Cool company culture, great growth potential",Can't even think of one
Amazon,Great company for Data Scientists,Dec 10,2019,4,Lots of data and opportunities for data scientists,Career paths are sometimes unclear
Amazon,-,Aug 26,2020,4,1. Competitive work environment 2. Best technologies,1. India - Seattle work culture difference
Amazon,jnavjnvnBLN:B,Sep 9,2020,5,"great work environment, supportive members",far from home and way too much traffic on the way
Amazon,good,Jul 2,2020,5,nice company to work in,nice boss talks gently to me
Amazon,Good,Aug 29,2020,4,It is very good company,Work pressure is very high
Amazon,BEST atmosphere,Sep 1,2020,5,Best atmosphere in working sector,No cons as such according to me
Amazon,good,May 25,2020,5,nice pay and promotion at work,work overtime sometimes but acceptable
Amazon,nice,Aug 2,2020,4,"nice to work ,very nice","lot of headache,can improve hi"
Amazon,Great Place,Aug 25,2020,4,Long working hours and stressful,Well paid and nice people
Amazon,Senior Data Scientist,Jun 25,2021,5,1. Competitive people 2. Good salary,1. No work life balance 2. Bad culture
Amazon,Great place to work,May 31,2021,5,"Have challenging work, and also great people to work with!","Majorly a business team, so tech knowledge may be respected"
Amazon,Awesome location,Jun 27,2021,4,Good for self motivated people,Lack of assessment from manager
Amazon,great place,Jun 15,2021,5,good work environment good culture,no cons as such till now
Amazon,Great company to work at,May 24,2021,5,"Exciting work, measured by output, culture is great","Compensation not always in line with FB, Microsoft, Apple"
Amazon,awesome experience,Jun 4,2021,5,work flexibility best culture nice team mates no dress code wifi availability,break time structure and documentation culture politics limited salary
Amazon,My boss blackmailed,Jun 25,2021,1,Great possibilities in terms of teams and change positions,"Very toxic culture in many departments, my boss blackmailed me to stay in my current position"
Amazon,Decent company to work for,May 7,2021,4,-Great pay - Amazing benefits - Good outlook for future,- Competitive - Very large corporation
Amazon,"Great company and conditions, but Not compatible with personal time",Apr 5,2021,5,Great conditions. Big career opportunities,"Complex systems, hard to learn"
Amazon,Very good,Apr 23,2021,5,very friendly environment that never ever other,unhealthy life style due to shift
Amazon,Hard work but worth it,Feb 5,2021,4,Company culture is very competitive. Keep up or don't expect career growth. Amazing learning opportunity working with some of the brightest minds in the UK.,No WLB but expected going into this
Amazon,Good,Apr 16,2021,5,Great experience till now working with Amazon,No cons as of yet
Amazon,Hit or Miss,Jul 18,2021,2,Lots to learn. Smart Colleagues.,Experience heavily affected by team and managers. Internal tools are horrible.
Amazon,Riview on company,Mar 2,2021,5,working culture is something to admire,There will be internal politics in the team
Amazon,Employeer review,Jan 26,2021,4,"Good place to work, freedom to work form anywhere, strong infrasture to support remote work. Friendly managers and employees.","Overwheling process, Some managers micro manage teams."
Amazon,Best company,Feb 22,2021,5,Excellent work experience at amazon,Work hour is the concern
Amazon,good,Feb 17,2021,5,it is superb experience tgdrf,it has no cons accordingly
Amazon,Data Science Analyst,Feb 8,2021,5,Very good work culture there,Nothing as of now to say
Amazon,Nice people,Jan 31,2021,5,Nice people and fun culture.,Not great pay and could do with better structure
Amazon,Great work,Jan 20,2021,5,I love working here and it is fun,No cons as of yet
Amazon,Awesome company,Jan 24,2021,5,"Nice work environment, good salary",No cons as of now.
Amazon,No place for data science,Jan 22,2021,1,Amazon operations is a place rich of use cases and a lot of data to develop them,"Current management is not interested at all in data science, they do not see/understand the benefit of it, it's a pity"
Amazon,amazon current employee,Dec 29,2020,3,the environment is great for new graduates,peer pressure and intensive workload
Amazon,Great Company,Nov 12,2020,5,Great company to build career in data science,No Cons except it is large company and might take a while to understand all the functions and business units.
Amazon,The best,Dec 24,2020,5,They seriously pay Good salary,Honestly I Haven't found one
Amazon,Data Scientist,Dec 16,2020,5,Great place to work amazon,hectic work to do all day
Amazon,Do Not Recommend Operations in Luxemburg,Feb 8,2020,2,- Amazon name and title on resume,"- Total metric overload: entire meetings go by with staff quoting dozens of metrics and people just going along as if an actual meeting is taking place. Metrics support your ideas and points they should not lead it. - Political: giving impressions of doing work is unfortunately more important than actually doing good work...a downside to a large corporation that has become hierarchical. If you don't promote your own work you won't get recognition. The Culture is hollow: people are nice and friendly but there is a dramatic cavity where there should be enthusiasm and joy. Friday night get togethers? nope. Coworkers hanging out during work? nope. People are friendly yes, respectful yes, but absolutely soulless compared to other tech companies. - Unfortuanately Hierarchial and not flat. I have not experienced such a hierarchial organization since i left insurance a dozen or more years ago. - the office in luxemburg is focused on operations and not product development---> would not recommend this to anyone looking for actual data science work."
Amazon,Good company but it could be so much better,Sep 17,2018,4,flexible working hours work from home there are many smart people around you who are more than willing to share their knowledge,work-life balance not so good highly political flying economy on inter-continental flights no matter your level very rigid HR compensation could be better no perks such as a car on leasing no food provided on campus no tech courses (such as Machine Learning University) in Europe
Amazon,"Amazing work environment for innovation, innovation and innovation!",Jul 26,2019,5,# Great salary package + bonus incentives including stock # One of the few companies here where a meritocracy exists # Great mentors in the form of managers who really know what their doing,# Long hours can be infuriating if you don't like what your doing
Amazon,Not a great place to work,Mar 26,2022,2,"I am working in AWS professional services. Interesting work, very knowledgeable and bright people. Good pay",Managers are clueless of what’s happening and they bring obstacles and judge you with very little knowledge. They don’t support individuals. even Faced discrimination by a manager.
Amazon,good,May 21,2022,5,"good company,Great to start,good salary",needs standard qualifications for higher posts
Amazon,ok,May 3,2022,4,"vast opportunities to learn, smart people",There is some misalignment between your role and responsibilities and expectation for growth
Amazon,it was overalll a really good experience,Apr 20,2022,4,good work ethics and good working conditions,less package and that can be a downside
Amazon,great,Apr 25,2022,5,good env for beginners and pros,not cons at the moment
Amazon,internationalization,Apr 28,2022,3,The management is very humanized,Sometimes work pressure is too high
Amazon,idkk,Apr 21,2022,5,"Good salary, Good co workers",Not so good work environment
Amazon,Good,Apr 17,2022,4,Everything good no problem at all.,"Nothing bad, no issue at all."
Amazon,Very nice company,Apr 5,2022,5,Nice wage and people working there,"Not really any, everything was ok"
Amazon,Meh,Mar 4,2022,2,"Salary is not that bad, some good people here and there.","A lot of politics, they tell you you will work on exciting stuff and you end up writing SQL queries the whole day."
Amazon,It's has been good so far. Quite impressed with the on-boarding process.,Jan 19,2022,5,Things are well documented and you must be ready to search them out.,As you will expect with big organisation but it is good
Amazon,Amazon works,Mar 4,2022,5,A good product based company,Product based company Lots to learn Job experience and security
Amazon,Ok,Jan 18,2022,3,Cool coy to work for today,Nothing much the coy is about great
Amazon,awesome job,Dec 28,2021,4,a very good place to work,it's a bit headache to work there
Amazon,Rating,Dec 30,2021,4,Pros are must in this firm.,Cons are few in this firm.
Amazon,Not bad,Feb 13,2022,1,Snacks lunch coffee game rest,Nothing really important to mention
Amazon,good place to learn,Nov 4,2021,4,"constantly learning opportunities and lots of responsibilities, pushed to process","org very chaotic and hard to move the needle, promotion process is painful"
Amazon,super good wlb,Nov 3,2021,5,"awsome wlb, remote work options, laid back culture","slowpaced, low pay, not miuch woirk"
Amazon,Nice company,Nov 1,2021,5,Love the company. I recommend,Demanding job but worth the experience
Amazon,A+,Aug 11,2021,5,The best firms out there in the market in the field of It and you can do data jobs here,There was non of the cons I ever seen in this company so enjoy working here for your future and good experience
Amazon,Good organization for learning and personal growth,May 29,2021,4,"- Learned and experienced peers to interact with - Flexibility to change roles and teams to avoid stagnation of learning and work - structured way of working and project management - Opportunity to work with global teams, and chance of travel","- poor appraisal process - on-call thing is frustrating - inter team politics as the teams grow - culture is not people centric, management will seem apathetic"
Amazon,Great Company,Aug 17,2021,5,"Great Company, really stingy owner though",Too big for my liking - but it is what it is
Amazon,5 years experienced at data scientist,Aug 19,2021,4,Good working hours and work life balance,Less pay but still good life balance
Amazon,Great company and great environment,Jul 12,2021,5,This compnany is great to work for with grt environment,I cant really say any negatives
Amazon,Super data science team,Jul 18,2021,5,Best working experience I have ever had.,There is no con here.
Amazon,Data Scientist,Jul 20,2021,5,Best company at Great Vancouver Area,You must best to work at Amazon
Amazon,Good job,Jul 12,2021,5,Good job with many opportunities,Busy schedule and a lot to do
Amazon,Senior Data Scientist,Jun 25,2021,5,1. Competitive people 2. Good salary,1. No work life balance 2. Bad culture
Amazon,So Far so good,Jan 22,2023,4,"Lots of great talent Interesting problem to solve Huge learning curve on both technical challenges and people management challenges Global team, work with people around the world very good for exposure in terms of career growth Good mentoring circle and lots of people open to share feedback","Hours are longer than standard Sometime expects to be available due to people in different timezone Communication from senior management could be more efficient Most team are in US focused timezone. Lots of activity fall outside of Australia Timezone. Employee benefit might have double standards, i.e. US vs non-US staff might have different treatment and compensation given the same level."
Amazon,Great experience working with amazon,Apr 9,2023,4,excellent guidance by senior data scientists.,the workload in summer and get fewer holidays.
Amazon,"Very talented people are around, and strong culture",Feb 24,2023,4,"- Talented people around - Good place to learn, especially if you like to build things from scratch","- Basic benefits, no free Prime nor ability to trade holidays - Feel like a small gear in a big enterprise (depend you like it or not) - Work with teams in different time zones can be challenging some time"
Amazon,Good company,Apr 4,2023,5,"Supportive teammates, competitive salary and benefits","Work life balance, no canteen"
Amazon,Good,Mar 13,2023,4,It was so hard to do i don't know,Very good it was so good
Amazon,Good Company,Mar 9,2023,4,Best Place tk Work for Full Time,.. ... ... .... ...
Amazon,Nice company to work with,Mar 2,2023,4,"Great leave policy , employee benefits, good pay scale as well",Not as of now found
Amazon,Good company,Jan 17,2023,5,"Great work life balance, very innovative",Work from US is often prioritized compared to other countries
Amazon,good,Jan 18,2023,5,organized and pays on time,low salary and night work shifts
Amazon,Best,Dec 29,2022,4,"Everything is fine, no problem",No cons at all present
Amazon,good workspace,Dec 17,2022,5,best place to work as a data scientist.,difficult to get selected as the vacancies are less
Amazon,Great place to learn,Nov 24,2022,4,- fast paced - lots of scale and complexity - really smart co-workers - great pay,- worklife balance can suffer depending on the team - data access processes outdated
Amazon,---,Feb 12,2023,3,Good compensation. Good learning curve.,Bad culture. Stress of work. Unrealistic deadlines.
Amazon,Cool,Dec 3,2022,5,Best culture for growth and success,Low work and family balance here
Amazon,Most customer centric company in the world,Sep 23,2022,5,"The scale of Amazon allows to have a big in impact in terms of customers and sales. The structure and face paced environment make you learn fast. It is relatively easy to change team, department and city within Amazon",A lot of work is required and no extra hours are counted
Amazon,Pros & cons of working in Amazon,Oct 5,2022,5,"Good salary, working for 3 days per week, paid 40$/1h, ...","Good salary, 40$/1h, 3 days a week,"
Amazon,A nice place for Inventors and SDE,Oct 11,2022,5,A lot of resources to collect and analyze,You need to conserve your time for priorities
Amazon,Great culture and opportunities.,Oct 21,2022,5,Flexibility to do work anytime and all resources are available.,Firm deadlines and push to finish early.
Amazon,Amazing experience,Oct 1,2022,4,Had the pleasure to work with the DS team for my 6-month internship. I learned so much during this time and would recommend this to anyone.,Pressure to deliver and learn topics quickly
Amazon,good,Sep 27,2022,5,growing company with a super technology,good place to work to devlop the techanology
Amazon,positive,Sep 2,2022,5,good conditions for a company,overworking hours in some situations
Amazon,Hmm,Apr 19,2022,4,"What are the pros and cons of working at Amazon? I recently left Amazon to start my own venture. I was there for a little under 2 years. The answer to your question will of course, vary by the person answering but in my perspective, it was the highlight of my career. It is a tough and demanding environment but I truly enjoyed my work and my time there, Below are the pros and cons based on my experience Pros 1. Big problems - At Amazon, no problem is pushed aside as too hard to solve. In fact, they go after the really hard and insolvable problems and then throw talent, time and resources towards solving them. In my time there, pretty much every team I worked with was solving a ""holy grail"" problem in their field and actually making progress towards it. There is no dearth of interesting projects, teams or ideas to work on. 2. Structure and thinking - There is a lot of document writing at Amazon, in case you have not heard. While some people do not like that part of the job much, I think the required meetings and documents force every employee to truly think about their job and what they are doing. Producing the write-ups and getting them ready to face up to a room of very detailed scrutiny and questioning forces you to think through every aspect of your business. it is really a very valuable skill that Amazon does a great job of developing. 3. Ownership - Amazon treats you like an owner - a grown up. You have a job to do and you are empowered to do it. There are checks and balances, of course, but you truly do own your business. You make the assessments, take the risks, justify your decisions and ultimately reap the benefits or learn from your mistakes and move on. There are not many fall-backs and layers to catch you if you are not moving your business forward. Not a lot of finger poitning for failures either, that I saw. In fact, I would say that if you do not act like an owner, you will not be successful at Amazon. You have to embrace the responsibility and run with it. 4. Smart People - You'll hear this a lot and personally, I think some of the talk is overblown but Amazon does indeed have some very, very smart and talented people working there. I know its a cliche, but I did learn a lot from most people I worked with there - and again, I say, most, not all :-) are just genuinely nice people. I would work again with these people without hesitation. I think the leadership there is especially great - just really smart, experienced people with sharp instincts, great insights and lots of ambition. It was really fun working with the folks I did.","What are the pros and cons of working at Amazon? I recently left Amazon to start my own venture. I was there for a little under 2 years. The answer to your question will of course, vary by the person answering but in my perspective, it was the highlight of my career. It is a tough and demanding environment but I truly enjoyed my work and my time there, Below are the pros and cons based on my experience Pros 1. Big problems - At Amazon, no problem is pushed aside as too hard to solve. In fact, they go after the really hard and insolvable problems and then throw talent, time and resources towards solving them. In my time there, pretty much every team I worked with was solving a ""holy grail"" problem in their field and actually making progress towards it. There is no dearth of interesting projects, teams or ideas to work on. 2. Structure and thinking - There is a lot of document writing at Amazon, in case you have not heard. While some people do not like that part of the job much, I think the required meetings and documents force every employee to truly think about their job and what they are doing. Producing the write-ups and getting them ready to face up to a room of very detailed scrutiny and questioning forces you to think through every aspect of your business. it is really a very valuable skill that Amazon does a great job of developing. 3. Ownership - Amazon treats you like an owner - a grown up. You have a job to do and you are empowered to do it. There are checks and balances, of course, but you truly do own your business. You make the assessments, take the risks, justify your decisions and ultimately reap the benefits or learn from your mistakes and move on. There are not many fall-backs and layers to catch you if you are not moving your business forward. Not a lot of finger poitning for failures either, that I saw. In fact, I would say that if you do not act like an owner, you will not be successful at Amazon. You have to embrace the responsibility and run with it. 4. Smart People - You'll hear this a lot and personally, I What are the pros and cons of working at Amazon? I recently left Amazon to start my own venture. I was there for a little under 2 years. The answer to your question will of course, vary by the person answering but in my perspective, it was the highlight of my career. It is a tough and demanding environment but I truly enjoyed my work and my time there, Below are the pros and cons based on my experience Pros 1. Big problems - At Amazon, no problem is pushed aside as too hard to solve. In fact, they go after the really hard and insolvable problems and then throw talent, time and resources towards solving them. In my time there, pretty much every team I worked with was solving a ""holy grail"" problem in their field and actually making progress towards it. There is no dearth of interesting projects, teams or ideas to work on. 2. Structure and thinking - There is a lot of document writing at Amazon, in case you have not heard. While some people do not like that part of the job much, I think the required meetings and documents force every employee to truly think about their job and what they are doing. Producing the write-ups and getting them ready to face up to a room of very detailed scrutiny and questioning forces you to think through every aspect of your business. it is really a very valuable skill that Amazon does a great job of developing. 3. Ownership - Amazon treats you like an owner - a grown up. You have a job to do and you are empowered to do it. There are checks and balances, of course, but you truly do own your business. You make the assessments, take the risks, justify your decisions and ultimately reap the benefits or learn from your mistakes and move on. There are not many fall-backs and layers to catch you if you are not moving your business forward. Not a lot of finger poitning for failures either, that I saw. In fact, I would say that if you do not act like an owner, you will not be successful at Amazon. You have to embrace the responsibility and run with it. 4. Smart People - You'll hear this a lot and personally, I think some of the talk is overblown but Amazon does indeed have some very, very smart and talented people working there. I know its a cliche, but I did learn a lot from most people I worked with there - and again, I say, most, not all :-) are just genuinely nice people. I would work again with these people without hesitation. I think the leadership there is especially great - just really smart, experienced people with sharp instincts, great insights and lots of ambition. It was really fun working with the folks I did. Cons 1. Structure and documentation - What I said above about structure and documentation, while its great to create clarity and shape your thinking, it can get in the way of actually doing your work. Everybody at Amazon is juggling so much and constantly writing high quality documents can get exhausting. The secret here, as in any job, is to balance the strategic against the operational and prioritize ruthlessly. I cannot say I was always effective at it - but I tried till my last day and now have the benefit of hind sight as well :-) 2. Culture - I think some people could have a tough time adjusting to the culture - its tough, expectations are high and there is not always a lot of hand holding ( in fact, it would be very rare). I think you have to embrace or at least accept it and focus on the positives. Your team makes a huge difference - so hopefully you're lucky and end up with a great manager and great team mates. If you're looking for free food and onsite massages - you certainly will be disappointed. You can end up overworked and resentful if you are not good at prioritizing your work and your life and making trade-offs. 3. People/Politics - I started to see a lot of the ""we are the best in the world"" mentality start to show up. I don't believe that everyone that works at Amazon is a genius and seeing that attitude crop up every now and then was annoying. Every company has inside politics and even though Amazon tries really hard to believe there is no politics, there is certainly that to deal with. No more than any other company that I can tell, but it can get frustrating when you're working so hard and so long to get derailed by that kind of thing. So there you have it - overall I loved my time at Amazon. I was exhausted (in a very good way) every day but couldn't wait to go back and keep making progress. I was lucky to have a great team, a really interesting area to work on and some awesome problems to tackle. some of the talk is overblown but Amazon does indeed have some very, very smart and talented people working there. I know its a cliche, but I did learn a lot"
Amazon,"Flexible hours, Great pay, Great team",Jul 3,2022,4,"Flexible hours, great offices, great team, great pay and benefits","Bureaucracy might be hard to navigate sometimes, troubles that come with any company of this size and scale"
Amazon,Amazon,Jul 16,2022,4,"good pay and benefit, a lot of challenge and interesting problem",have stress. career goal is not clear
Amazon,Good,Jul 24,2022,4,Make people understand how life works,Give people chance to explain them selves
Amazon,"Very nice place to work, great benefit, great resources, talent people",May 24,2022,5,"Amazon is the best working place! I love the working environment, talent people in the company, great resources and flexible working arrangements!","haven't found so far, if meal could be provided now and then, it will be even better!"
