company,title,date,year,rating,pros,cons
Meta,Data Scientist,Oct 17,2020,4,"location, salary, benefits, employees, technologies","big company, small impact, compatition"
Meta,"Mixed feelings, not a place for a parent",Dec 4,2019,3,"Great benefits, nice people to work with, great flexibility","No work-life balance. Data Science is basically ""product data science"" and in most cases this translates in very little coding and no machine learning. Pressure is constantly high and unhealthy. Not many parents around and I can definitely see why.. If you want to be successful you basically have to give up the rest of your life and money cannot buy everything..."
Meta,Data Scientist,Jul 11,2018,5,"It's a great company with great culture. You own your career here and if you develop good cross-functional work, you will be very successful here.","I don't really have big cons about this company. I've been learning a lot, working a lot and at the same time encouraged to manage work and life time."
Meta,Awesome place to work,Sep 4,2015,5,"#1: more impact/person than possibly any other organization on the planet Also: brilliant and friendly coworkers, ridiculous perks, emphasis on career development and learning","Most people don't have a great work-life balance, but it's always self-selected/self-imposed. (Culture is focused on impact rather than time spent working, so working longer hours is not measured or inherently valued.)"
Meta,Amazing employer with lots of challenges and opportunities to learn and grow,Oct 16,2017,5,"Amazing colleagues who care about their work and colleagues Challenging problems Very self-led, opportunity to drive what you care about Extremely flexible work environment with working from home options, amazing benefits","Work-life balance is not always easy, there is pressure to perform but also always lots of work to do"
Meta,Great Working Environment,Dec 10,2019,3,"Great office. Good benefits, lots of free stuff","Feels like a cult, too many 'smartest guys in the room', collaboration hard to find"
Meta,"Great internally, bad externally",Jun 10,2020,4,"Great culture, the day-to-day is hard to fault",Everything we are (rightly) criticized for weighs heavily on me and many employees
Meta,Bad mgrs,Dec 14,2019,2,"benifits and perks, flexible hours","managers and proffesional chanllenges, lots of meetings and too much time spent on coomunications"
Apple,Okay ish place,Mar 2,2023,5,Good teammates and smart folks,No free lunch literally and metaphorically
Apple,terrible experience,May 3,2023,1,a big company with talented people,"long hours, no work-life balance, no respect from leadership, micro-management"
Apple,Tough but rewarding,Mar 10,2023,3,working with very smart colleagues,very fast paced and always working on multiple projects at once
Apple,Overall a Positive Experience,Feb 17,2023,5,"Good pay, lots of perks and merch, workload is light",Not building anything meaningful or complex
Apple,"Extremely top down, but otherwise good",Feb 12,2023,4,No overhiring; Focus on impact; WLB not bad,"Top down culture, that drove talents out; Older facility office; Compulsory RTO"
Apple,Good,Feb 2,2023,4,Some and a lot like being able to work in a lot of projects,There are some cons if you do not work with passion
Apple,:),Nov 3,2022,4,good salary and great people to work with,very competitive but its worth it
Apple,Wow,Oct 23,2022,5,Awesome company to work with,"No Cons, Too much money"
Apple,Good company,Aug 18,2022,3,Well managed for such a big size,Work tends to be intensive.
Apple,Best Corporation for Engineers,May 18,2022,4,"Values innovation. Not worried about cost cutting. New ideas welcomed. Fantastic insurance, gym. Work pays for phone, phone bill, and computer.",Crushing office politics. Hard work expected. Often work after hours.
Apple,Great Company!,Mar 16,2022,5,"Good environment, good colleagues, good leadership!","Less money, less chance to upgrade！"
Apple,apple,Dec 1,2021,5,"Working at Apple was a great experience. Work never felt like work because I loved what I did and I loved interacting with the public. The store was always electric, although others may say crazy. I'd say electric because the experience was exhilarating.",This is a job I truly miss and I am thankful for the opportunity that I was given!
Apple,Good,Jan 5,2022,5,Very good growth opportunities at Apple,Nothing cons were experienced at apple
Apple,na,Apr 25,2022,2,none to share for now,work schedule is tremendously hectic
Apple,Great,Dec 14,2021,5,Great work places exciting work,More work life balance and more vacation
Apple,Best team ever,Nov 12,2021,5,Fantastic team culture and always a growing challenge. Supportive and inclusive environment.,Big ships turn slowly. We rarely use the newest bleeding-edge tools.
Apple,"Great company, as expected",Dec 2,2021,5,World-wide & cutting edge challenges,"Large company, hence some cross-functional hurdles"
Apple,Working,Nov 6,2021,5,Great culture and lots of perks.,Have to work in the office.
Apple,Not bad for the Grind,Nov 17,2021,4,- pay and benefits -environment and the people,- some management in particular can be off putting
Apple,a,Oct 13,2021,5,a good choice for a good choice,sometimes you just need to move on
Apple,"Smart people, too much politics",Aug 24,2021,4,working with smart people good salary,too much politics no clear guidelines for promotion too hierarchical top down
Apple,Great Company,Apr 15,2021,5,I have been working at Apple for almost a year now and have thoroughly enjoyed it. Coming from an academic background I was worried that working for a big company would involve sacrificing time spent learning and discovering new ideas/methods but I have had plenty of opportunities to do this,Since I was hired after the coronavirus lock-downs I have not actually met many of my colleagues in person.
Apple,Critical,Jul 22,2021,5,Too good for someone who have comp sci degree,Not bad for who have electrical engineering degree
Apple,"Cool work, long hours",Jul 13,2021,4,"Exciting work, surrounded by very small people","very political, top down style of management"
Apple,.,Jul 16,2021,4,Lots of opportunities to grow,.work life balance not so good
Apple,A company with a lot of resources and intelligent people,May 6,2021,5,"Tons of resources, lots of ways to learn and grow, great benefit",Your impact to the whole company might be limited compared to working at smaller company
Apple,Great,Jul 5,2021,5,Money for days and days,"No windows in the office, get it?"
Apple,it was good for new grad,Jun 24,2021,4,"strong colleagues, and good collaboration","top down culture, false fire drills"
Apple,Great environment,May 16,2021,5,"Everything, Everything, Everything, Everything, Everything,","Nothing, Nothing, Nothing, Nothing ,Nothing, Nothing"
Apple,Great work place and atmosphere,May 10,2021,4,Very smart people and good working experience,WLB not as good as some other competitive tech companies
Apple,very good,Apr 17,2021,5,excellent place to work for life time.,there is no bad side here.
Apple,Great place to work,Jan 26,2021,5,"The work/life balance is great, good company culture and smart people to work with","office politics can get in the way of some smart decisions and being a more feel-first tech company, decisions can be less data driven"
Apple,ok sir i wont put the bad language,Jun 2,2021,1,nothing but all wrong please dont go.,cons is that you work there
Apple,Good one to work!,Feb 26,2021,5,"good work/life balance, good benefit",work pressure sometimes is big
Apple,good,Feb 15,2021,5,really enjoy to work here,the company is too big
Apple,Well managed,Feb 1,2021,3,Well managed company. Good innovations.,Can be tough on schedule and pushing people hard.
Apple,Amazing place to learn and work!!,Jan 13,2021,5,Amazing place to learn and work!!,Nothing bad about the company and its great culture
Apple,Great,Jan 12,2021,4,Great environment and work culture,Gets too stressed occasionally and tiring.
Apple,good,Jan 12,2021,5,fun workplace and great people,lots of work to do
Apple,Hello World,Jan 8,2021,3,Flexibility on Projects Assignment work,Not much perks and snacks
Apple,Very good company,Dec 30,2020,5,very good perks and benefits,there are no cons to say
Apple,Apple benefits,Oct 23,2020,1,Healthy competition with people and good snacks,Computers are a bit opd and iphones are very old like 1950
Apple,Good company to work for as long as you know which group you are joining for,Apr 21,2019,4,"- Good work life balance depending on your team - Could be interesting work but your project also depends on how your manager thinks personally of you. If you don't get on well, you might end up with projects no one wants to work on. - Great benefits from the company including good food, good 401k, health insurance etc. - Supportive environment for personal development.","- Recruiters are usually bad and unprofessional. They usually try to lowball you (as typical) but if you try to negotiate, they become aggressive and even rude. - Very unbalanced compensation even within the same teams. Study up your numbers well before signing up. - Secrecy - Very non-uniform groups within the company. There are big differences between different organizations so you might have totally different experience for the same/similar job responsibilities depending on whether you are part of engineering, operations or (scary, the one to avoid at all cost) IS&T groups."
Apple,Data Scientist,May 18,2018,4,"Interesting projects Resources (hardware, software licenses etc) are taken care of People are smart, inclusive, articulate. Great benefits Good food There's a group for pretty much any hobby/interest, so it's easy to meet new friends when you're new to town","Open concept offices taking over and making it impossible not to have glare on your screens. No visibility into promotion opportunities, org changes always come as a complete surprise to most. Leads to confusion about career growth potential. Very little emphasis on training managers, lots of growing pains when people get promoted. Can be a bit on the bureaucratic side."
Apple,great place to learn. slow to grow.,Apr 11,2019,4,"At the beginning you can learn a lot and see how a big company works. Depending on teams, data scientists have a lot of freedom.",Unstructured. Infra structure is not as great as some other big companies. Growth is slow which is natural for big companies.
Apple,"Really good people, platform for growth could be better",Apr 19,2019,4,My team is really solid. The manager cares about your growth and development. Offers good advice on technical and soft skills to work on. Internal learning resources are also abundant.,"Moving slowly into a more data-driven culture. A lot of things are done according to people who have been at the firm for a long time. There are organizational habits that are difficult to change, and making it potentially difficult for data science to have a bigger voice in decision making (but it certainly depends on your organization)."
Apple,Awesome Workplace,Jun 22,2020,5,Experience Tacky Strategic Requires a lot of cross org interactions.,"Politics, Slow process, Nothing NA I love my APPLE :)"
Apple,A Great Place to Work,Nov 9,2015,5,Very cool stuff is happening,"A very hardworking environment, people work so hard here"
Apple,Excellent place to work!,Dec 30,2019,5,"Love the work, products, impact on the world",It's hard to find one!
Apple,Innovative,Jun 9,2020,5,"Great environment, great people, get to go to WWDC sometimes","Top down culture, no remote work"
Apple,Data Scientist,May 14,2018,4,1) You get to work on some really impactful projects - touching millions of people 2) You are in the company of some pretty smart people,Moving within the organization to other business units is not encouraged
Apple,Wonderful Place to Work,Jul 14,2018,4,Benefits and compensation are great Opportunity to work with other exceptional individuals,It's work to keep from taking on too much work Very demanding work environment
Apple,Good management,Sep 23,2019,4,"As a big company, the management is good.","Too much bureaucracy in place, although it is understandable for such a large company."
Apple,Good,May 21,2019,4,The team is great but the work,The vision of the company is very niche and narrow. Should expand.
Apple,Amazing place to work,May 15,2023,5,Wonderful team to work with,Work pressure is very high
Apple,Great,Apr 9,2023,4,"Good, effective, efficient workplace management",Not much of cons here
Apple,Job status,Oct 23,2022,5,Nice work environment for people,Nice nice nice nice Nice
Apple,good,Sep 5,2022,5,it is a good comapny,it is a not a bad comapny
Apple,naicue,Feb 16,2022,4,very very very nice good,dunno not applied yet honestly
Apple,shortages of chips,Nov 4,2021,5,A lot of base of datas,Apple gives opportunities for developning
Apple,General Good,Aug 11,2021,5,"Great salary and full of creative project, which I learned knowledge and met great stuff in company. The stuff benefits are good too.","People are very separated from their works, and sometimes teams are not efficient and effective enough. Some projects are micro-managed."
Apple,Yes,Jul 15,2021,5,Pay phones MacBooks and employers,No no no no no
Apple,lol,Jan 23,2021,5,amazing office and environment and food,salary pay per annum and hour
Apple,Its a good company with great salaries,Feb 5,2019,5,"Trading , good environment,good salary","working hard,bad people , bad Ceo"
Apple,Good company,Mar 16,2020,5,"Good salary , good employees,good organization to work","Work load is heavy,access work load"
Apple,Senior Barista Caffe Macs,Jun 5,2023,5,"Benefits, pay, every one is friendly",Need help getting transferred to Elk Grove/ Sacrament area. Im having a hard time getting transferred and would like more support
Apple,Exploring the Pros and Cons of Working as a Data Engineer at Apple,Apr 30,2023,4,"Growth opportunities: Apple is one of the most innovative companies in the world, which means there are many opportunities to grow and learn as a data engineer. Salary and benefits: Apple is known for offering competitive salaries and excellent benefits to its employees, including health insurance, retirement plan, paid leave, and much more.","Intense work pace: Apple is known for having an intense and demanding work culture, with tight deadlines and high expectations. Pressure for results: As a data engineer, you may face constant pressure to produce results and innovative solutions quickly."
Apple,Good company,May 7,2023,4,Really enjoyed my team and the pay is good,Sometimes leadership is not clear on goals
Apple,terrible experience,May 3,2023,1,a big company with talented people,"long hours, no work-life balance, no respect from leadership, micro-management"
Apple,Good place,Apr 3,2023,5,Nice environment loved it there very ncie,No cons loved it there
Apple,The best company culture,Mar 31,2023,5,Many interesting tools and projects.,Management was not addressing the issues correctly.
Apple,Tough but rewarding,Mar 10,2023,3,working with very smart colleagues,very fast paced and always working on multiple projects at once
Apple,Okay ish place,Mar 2,2023,5,Good teammates and smart folks,No free lunch literally and metaphorically
Apple,Overall a Positive Experience,Feb 17,2023,5,"Good pay, lots of perks and merch, workload is light",Not building anything meaningful or complex
Apple,"Extremely top down, but otherwise good",Feb 12,2023,4,No overhiring; Focus on impact; WLB not bad,"Top down culture, that drove talents out; Older facility office; Compulsory RTO"
Apple,Good,Feb 2,2023,4,Some and a lot like being able to work in a lot of projects,There are some cons if you do not work with passion
Apple,Good Apples,Nov 15,2022,5,Good culture and awesome atmosphere,Hard work is required and respect
Apple,Not great culture,Oct 12,2022,2,There's a team for everything so there's no need to run any system yourself. They'll send you all around the world in first class. Apple Park is stunning. Everyone is smart.,"People are not nice, they often want to work alone rather than collaborate. Honestly the pay isn't as high as you'd think and the benefits aren't great. They don't sponsor you to go to conferences, at least in my organization. It's hard to move between orgs because it's so secretive. Overall I wouldn't recommend an engineer work here."
Apple,Overall Excellent job. Pay is a little lower than other FANG but WLB is great,Aug 26,2022,5,"Great work life balance, interesting projects, stock has increased 4x over my employment so salary has been very high due to stock appreciation.","Return to office, occasionally mundane assignments. Lots of red tape. Pays less than other top tier companies."
Apple,Wow,Oct 23,2022,5,Awesome company to work with,"No Cons, Too much money"
Apple,Management,Nov 21,2022,4,Great opportunity for customer rapport and customer relationships. Room for career development and clear representation of diverse community and company culture.,Horrible management that did not have proper core values and good morals.
Apple,Rock solid management and brand,Sep 6,2022,5,Good work culture Talented engineers and designers Attention to details,Not the best pay master Very top-down management approach
Apple,:),Nov 3,2022,4,good salary and great people to work with,very competitive but its worth it
Apple,Good work culture,Aug 19,2022,5,good work culture time management,not so good work culture not sure
Apple,Apple smells!,Oct 30,2022,3,good management and fun times,Bad stuff and other bad stuff
Apple,Great company to work for,Oct 11,2022,4,Great company to work for,No cons Apple treat their employees really good
Apple,Micro management and toxic team environment,Jan 25,2022,2,Great benefits Good pay product discount Great company culture but not in all teams.,"Team culture is totally opposite to company culture. Very toxic team environment, never encouraged for cross training and change of responsibility. People around you working on same things for more than 5 years. If you ask for change in responsibility or cross training manager would decline. Manager expect you to work on same thing every day. You would have no motivation lack of new responsibilities and challenges. Very micro managing by manager feels like you are working in store as an hourly employee so you have to answer for every minutes you worked on which task. You need to take permission from your manager for 1:1 with their managers. You have to include your manager as an optional in all meetings you schedules with your stakeholders so your manager keep an eye on you."
Apple,good,Oct 10,2022,3,company pays well for the position.,sometimes too much work for what I get paid.
Apple,Good place to work,Aug 12,2022,4,- lots of benefits and perks - Apple has huge amount of data which can be great for data engineer to challenge ourselves to solve painful issue - a bunch of smart and talented people at Apple,Ownership can be messy for cross team project hard to move up
Apple,Awesome,Jun 14,2022,5,Great pay for all entry level positions.,Long work hours for all entry level positions.
Apple,Can be relied upon to consistently maintain a high quality of work.,May 21,2022,5,"Stable , reliable, friendly,experienced and kind.",None none none none none
Apple,"Good Benefits, Should be more RTO flexible",Aug 21,2022,4,-Good benefits -Good stock options and comp,"- forced RTO, makes it questionable with Covid."
Apple,Yes good,Jun 1,2022,5,Okay and it is better,Not really conservative lol for the most. Part
Apple,Decent work-life balance,Aug 10,2022,3,"Worked about 35 hours a week No crunch time Job stayed within expectations Good data modeling software, freedom to choose analytics applications",Poor office culture Non-competitive pay
Apple,Good company,Aug 18,2022,3,Well managed for such a big size,Work tends to be intensive.
Apple,Great culture,Jul 6,2022,4,Love the culture and people here. Apple provides flexibility and opportunities if you do well here.,Pay is not as competitive as I would like.
Apple,Nice company,Apr 20,2022,5,It’s apple and amazing environment,Growth options within the company
Apple,Best,Apr 20,2022,5,Best Best Best Best Best,None None None None None
Apple,Great Company!,Mar 16,2022,5,"Good environment, good colleagues, good leadership!","Less money, less chance to upgrade！"
Apple,Contractor with half the normal pay,Mar 7,2022,5,Get to learn the internal infrastructure,The pay is literally half the usual one for a SWE.
Apple,Best Corporation for Engineers,May 18,2022,4,"Values innovation. Not worried about cost cutting. New ideas welcomed. Fantastic insurance, gym. Work pays for phone, phone bill, and computer.",Crushing office politics. Hard work expected. Often work after hours.
Apple,very,Jun 10,2022,4,very nice very nice very nice very nice,a little a little a little a little
Apple,apple,Dec 1,2021,5,"Working at Apple was a great experience. Work never felt like work because I loved what I did and I loved interacting with the public. The store was always electric, although others may say crazy. I'd say electric because the experience was exhilarating.",This is a job I truly miss and I am thankful for the opportunity that I was given!
Apple,Life at Apple,Feb 23,2022,5,"Teamwork, benefits, atmosphere, and salary",Working from home and time off
Apple,Da,Feb 20,2022,4,Good cause help rich people,Not good helping poor people
Apple,DA,Feb 28,2022,3,Company is full of ambitious individuals,Location is not the best
Apple,Contracted Data Analyst,Feb 9,2022,4,- WFH - Little micromanagement - Freedom,- No growth opportunities - High turnover rate - Can't negotiate benefits
Apple,Blah,Feb 12,2022,3,"Security, benefits, stock, hardware, location","Not competitive with other service, dev enterprises"
Apple,Big tech experience,Jan 12,2022,4,"Fast paced, Lots of opportunities for learning and some independence in engineering role, Great benefits","Keeping up appearances/office politics, inflexible long-term remote working policy"
Apple,nice campus,Apr 12,2022,1,they have very good perks,"no life, work work and work"
Apple,Working,Nov 6,2021,5,Great culture and lots of perks.,Have to work in the office.
Apple,Na,Oct 29,2021,5,People are the center of everything,Work can sometimes be draining
Apple,Senior Data Analyst,Nov 1,2021,5,Senior Data Analyst Awesome Awesome,None None None None None
Apple,a,Oct 13,2021,5,a good choice for a good choice,sometimes you just need to move on
Apple,"Great company, as expected",Dec 2,2021,5,World-wide & cutting edge challenges,"Large company, hence some cross-functional hurdles"
Apple,Not bad for the Grind,Nov 17,2021,4,- pay and benefits -environment and the people,- some management in particular can be off putting
Apple,"Smart people, too much politics",Aug 24,2021,4,working with smart people good salary,too much politics no clear guidelines for promotion too hierarchical top down
Apple,Great company - depends on the org,Aug 6,2021,4,Well respected and good sense of ownership.,WLB can be a challenge
Apple,Great Company,Apr 15,2021,5,I have been working at Apple for almost a year now and have thoroughly enjoyed it. Coming from an academic background I was worried that working for a big company would involve sacrificing time spent learning and discovering new ideas/methods but I have had plenty of opportunities to do this,Since I was hired after the coronavirus lock-downs I have not actually met many of my colleagues in person.
Apple,Data Engineering Manager,Aug 15,2021,5,Good learning experience and opportunities,At times it get very busy
Apple,data,Jul 28,2021,5,good salary and benefits for employee,none none none none none
Apple,A company with a lot of resources and intelligent people,May 6,2021,5,"Tons of resources, lots of ways to learn and grow, great benefit",Your impact to the whole company might be limited compared to working at smaller company
Apple,Great,Jul 5,2021,5,Money for days and days,"No windows in the office, get it?"
Apple,Review,Jun 29,2021,5,Good company policies Good benefits Healthcare free,Not have option for fully remote work
Apple,Good,Jun 16,2021,5,Apple is a very good Company.,Base is low compared to other companies.
Apple,Great environment,May 16,2021,5,"Everything, Everything, Everything, Everything, Everything,","Nothing, Nothing, Nothing, Nothing ,Nothing, Nothing"
Apple,amazing,May 18,2021,5,"wonderful, honestly best place to work","none, I hope to stay forever"
Apple,very good,Apr 17,2021,5,excellent place to work for life time.,there is no bad side here.
Apple,Data Analyst at Apple,Mar 31,2021,5,Cares about employees overall well being,"Lots of documentation and meetings, very limited time to get work done."
Apple,Great place to work,Jan 26,2021,5,"The work/life balance is great, good company culture and smart people to work with","office politics can get in the way of some smart decisions and being a more feel-first tech company, decisions can be less data driven"
Apple,n/a,Apr 9,2021,5,"great work environment, fast paced","difficult tasks, fast paced, no consistency"
Apple,Great place to work,Feb 22,2021,5,Great support overall. Management is really good.,"maybe too chilled. If you like an intensive startup-like workplace, you may feel it's a bit slow."
Apple,Opportunities for everybody,Mar 10,2021,5,"Gives you opportunities to interesting work, growth, fair pay, RSUs, bonus.",Growth is a little complicated.
Apple,"Cool work, long hours",Jul 13,2021,4,"Exciting work, surrounded by very small people","very political, top down style of management"
Apple,.,Jul 16,2021,4,Lots of opportunities to grow,.work life balance not so good
Apple,Good one to work!,Feb 26,2021,5,"good work/life balance, good benefit",work pressure sometimes is big
